{
  "schemaVersion": "1.0",
  "kind": "visual-ocr-observation-result",
  "requestId": "math-function-graph",
  "subjectPack": "math-answer",
  "fixtureKind": "synthetic_fixture",
  "sourceRequestSha256": "233adef90af9ccda9109cdd49987853037aacae49d69f49e280a46d7579b8804",
  "preprocessingResult": {
    "artifactRef": "eval/visual-preprocessing/cases/math-function-graph.visual-preprocessing-result.json",
    "rawByteSha256": "9dc94ae6d5eee7142e9acf779bff39859914d57acbaf1cc9bcab2112e9c4627b",
    "requestId": "math-function-graph"
  },
  "crop": {
    "artifactRef": "math-function-graph.crop-2x.png",
    "scale": 2,
    "rawByteSha256": "77911d7a23d34a664a907e596a421fd3fea575d53b191ee29c0030e773c66d92",
    "decodedRgbPixelSha256": "f7384abdf7091caf909056ca3d3698709bcce53ae9997bd13d5132b4e284dc9a",
    "pixelSize": {
      "width": 460,
      "height": 370
    }
  },
  "structureExtractionResult": {
    "artifactRef": "eval/visual-structure-extraction/cases/math-function-graph.visual-structure-extraction-result.json",
    "rawByteSha256": "9b8cf6317ba97678fe64eedf50fbf3ddaa40b8b45bb535b5945ce4d9f8f795c0",
    "requestId": "math-function-graph"
  },
  "coordinateSpace": "crop_pixel",
  "observations": [],
  "summary": {
    "observationCount": 0,
    "observedTextSha256": "37517e5f3dc66819f61f5a7bb8ace1921282415f10551d2defa5c3eb0985b570"
  },
  "dispositions": {
    "observationStatus": "completed",
    "groundTruthAvailable": false,
    "acceptanceDisposition": "not_evaluated",
    "requiresHumanReview": true,
    "semanticDisposition": "not_inferred",
    "trackDisposition": "not_integrated"
  },
  "runtimePolicySha256": "530b5c7d81e50b62db108bacdcb9379938c473b60c2f4100557a61f7ab49eadd",
  "engineProvenance": {
    "engineKind": "local_runtime",
    "engineId": "rapidocr-onnxruntime",
    "engineVersion": "1.2.3",
    "executionProvider": "CPUExecutionProvider",
    "components": {
      "onnxruntime": "1.27.0",
      "opencv": "5.0.0",
      "pillow": "12.3.0",
      "numpy": "2.5.0"
    },
    "artifacts": {
      "configSha256": "a61ac7c6f753b9840ae77306f31a4845788c530d8ebe950f0c5476e30b984917",
      "detectionModelSha256": "3439588c030faea393a54515f51e983d8e155b19a2e8aba7891934c1cf0de526",
      "classificationModelSha256": "e47acedf663230f8863ff1ab0e64dd2d82b838fceb5957146dab185a89d6215c",
      "recognitionModelSha256": "897a3ededb38fee0dae2c1ccee38241f37df202c9509e3abca02e9217c5ee615"
    },
    "liveProvider": false,
    "cloudEgress": false
  },
  "generatedAt": "2026-07-27T03:00:00Z"
}
